Quae res et latus ullum castrorum ripis fluminis muniebat et post eum quae erant tuta ab hostibus reddebat et commeatus ab Remis reliquisque civitatibus ut sine periculo ad eum portari possent efficiebat. In eo flumine pons erat. Ibi praesidium ponit et in altera parte fluminis Q. Titurium Sabinum legatum cum sex cohortibus relinquit; castra in altitudinem pedum XII vallo fossaque duodeviginti pedum muniri iubet.	thalamēgus -ī, f. [houseboat],patinātor rotālīs -ōris, m. [roller-skater],(ad)minister pūblicus -ī, m. [secretary]	In quodam oppido sita erat domus in aqua vehebatur, thalamēgō habitabat. Thalamēgus nautae familiaris erat, maris amator. Patinātor rotālīs nomine Lūcius, minister pūblicus, ad locum venit. Lūcius, cavernis plenam habebat ex magna palaestra, ubi turba spectantium spectaculum eius amatissimum expectabat. Thalamēgus et minister pūblicus in amicitia magna erant. Interdum minister pūblicus ad thalamēgi domum adveniebat, et inter paginās in plagā riverā lambentibus, de civitatis negotiis loquebantur. Thalamēgus ministeri pūblicō multas fabulas de navigatione edocebat, et minister pūblicus eum de urbis rebus docēbat. Sic pariter se invicem docebant et inter se amicitiam servabant.	gpt-3.5-turbo-1106
Postquam tamen pauca milia passuum a litore Troiae progressi sunt, tanta tempestas subito coorta est ut nulla navium cursum tenere posset, sed aliae alias in partis disicerentur. Navis autem qua ipse Ulixes vehebatur vi tempestatis ad meridiem delata decimo die ad litus Libyae appulsa est. Ancoris iactis Ulixes constituit nonnullos e sociis in terram exponere, qui aquam ad navem referrent et qualis esset natura eius regionis cognoscerent. Hi igitur e navi egressi imperata facere parabant. Dum tamen fontem quaerunt, quibusdam ex incolis obviam facti ab iis hospitio accepti sunt. Accidit autem ut maior pars victus eorum hominum in miro quodam fructu quem lotum appellabant consisteret. Quam cum Graeci gustassent, patriae et sociorum statim obliti confirmaverunt se semper in ea terra mansuros, ut dulci illo cibo in perpetuum vescerentur.	deltaplānista -ae, f. [glider-person],incessus grallatōrius -ūs, m. [walking-on-stilts],dēfectus -ūs, m. [eclipse]	Dum deltaplānista clivo altō volābat, subitō dēfectus solis eam obscurāvit. Tum incēssum grallātōrium cōnspexit, quae per sōlitūdinem ambulābat. Deltaplānista, suspīrāns, statim descēndit ad terram, et, mīrāns inceptum incedendī super stīltibus, audāciam eius admīrābātur. Multa ab illā audīvit et dē suā vōce cōnstituit eam in suam historiam includere. ####	gpt-3.5-turbo-1106
 Hac oratione habita mirum in modum conversae sunt omnium mentes summaque alacritas et cupiditas belli gerendi innata est, princepsque X.	athletismus rēmigatōrius -ī, m. [rowing],ventilābrum -ī, n. [ventilator],tosta -ae, f. [toast]	Hāc orātiōne habita, Gaiī mentēs conversae sunt mirum in modum. Ea cotīdiāna sit, Gaius in salūtāriō suō sedēbat et pāne tōstō frūēbātur. Repente, tamen, athletismō rēmigātōriōnque interesse coepit. "Certē," sēcum putāvit, "nōnne mē opus est corpore exercēre ut athlēta efficiār?" Ita, Gaius ventilābrum cēpit et mēnsum per rēleventem remōs movēbat. Cōnātūs suōs ostendere volēns, Gaius ad lūcam athletismī rēmigātōriī contendit. Ibi sociōs novōs invenit, et simul cum illīs remōrum viās discere coepit. Talia exercitātiōnēs, quamquam dūrae, eī maximam voluptātem attulērunt.  Post multōs labōrēs et dūrōs annōs, Gaius tandem athlēta perfectus esse coepit et in rēgātōriō certāmina decertāre. Magnō cum studiō et alacritāte ad competitiōnēs sē praeparāvit et multōs laurōs ac praemia auctōritātis assecūtus est.  ####	gpt-3.5-turbo-1106
Ubi is dies venit quem rex ad arandum agrum edixerat, Iason orta luce cum sociis ad locum constitutum se contulit. Ibi stabulum ingens repperit, in quo tauri erant inclusi; tum portis apertis tauros in lucem traxit, et summa cum difficultate iugum imposuit. At Aeetes cum videret tauros nihil contra Iasonem valere, magnopere miratus est; nesciebat enim filiam suam auxilium ei dedisse. Tum Iason omnibus aspicientibus agrum arare coepit, qua in re tantam diligentiam praebuit ut ante meridiem totum opus confecerit. Hoc facto ad locum ubi rex sedebat adiit et dentis draconis postulavit; quos ubi accepit, in agrum quem araverat magna cum diligentia sparsit. Horum autem dentium natura erat talis ut in eo loco ubi sementes factae essent viri armati miro quodam modo gignerentur.	canis vēnāticus (v. canis consistēns) -is, m. [setter-dog],linea externa (campī) -ae, f. [boundary-line],periscopium -ī, n. [periscope]	Die quodam, in spelunca lupus ferox habitabat. Is lupus nunquam agrum intravit, sed semper extra lineam externam manebat. Sed quidam agricola, nomine Lucius, perīscopium comparavit ut lupum servaret longius. Canis vēnāticus, quem Lucius vocavit "Tigris," lupum semper custodiebat. Quotidie Lucius lupum per periscopium spectabat, servans agrum suum ab eius noxia. Lupus nihilominus frustra tentavit agrum intrare, sed canis vēnāticus eum semper a porta repulit. Lucius, agricola prūdēns, periscopium et canem vēnāticum utīle esse docuit et agrum suum a periculō lupī servāvit.	gpt-3.5-turbo-1106
Cum tamen Colchis multorum dierum iter ab eo loco abesset, solus Iason proficisci noluit. Dimisit igitur nuntios in omnis partis, qui causam itineris docerent et diem certam conveniendi dicerent. Interea, postquam omnia quae sunt usui ad armandas navis comportari iussit, negotium dedit Argo cuidam, qui summam scientiam nauticarum rerum habebat, ut navem aedificaret. In his rebus circiter decem dies consumpti sunt; Argus enim, qui operi praeerat, tantam diligentiam adhibebat ut ne nocturnum quidem tempus ad laborem intermitteret. Ad multitudinem hominum transportandam navis paulo erat latior quam quibus in nostro mari uti consuevimus, et ad vim tempestatum perferendam tota e robore facta est.	sēlectio (generatōria) -ōnis, f. [breeding-selective],digitus ānulāris -ī, m. [ring-finger],prōlapsio super undas -ōnis, f. [surfing]	In urbe maritima, Quintus, iuvenis insignis, studio ānulārium et prōlapsionis super undas vacabat. Tamen, magistrī eum ad sēlectiōnem generātōriam duxērunt, ut disceret quālis digitus ānulāris esset idōneus.  Quintus, rēs hūc illūc cōgitāns, dīxit sēlectiōnem generātōriam esse nōndum nōvitātem, sed id quod semper ā valentībus puerīs exspectātum sit. Namque digitus ānulāris, quī passionem vēritātem amōremque repraesentat, idōneus et fīrmus esse dēbuit. Tum, cum magistrī eum dēsīderiīs rēctiōnēs docuissent, Quintus in prōlapsiōne super undās dēdī operam.  Et ita, post multās tempestātēs et labōrēs, Quintus ingentī sēnsū laetitiās implebātur, quamquam multī labōrēs rēliquī erant. Sed cum diēs, in quō digitus ānulāris optimē idōneus esset, appropinquāret, Quintus gaudium suum continuē protulit. Et sīc fīnem habuit fabula de Quintō, quī per sēlectiōnem generātōriam digitum ānulārem aptāvit et posteā prōlapsiōnem super undās cum laetitiā excoluit.	gpt-3.5-turbo-1106
Brevi intermisso spatio Argonautae ad flumen Phasim venerunt, quod in finibus Colchorum erat. Ibi cum navem appulissent et in terram egressi essent, statim ad regem Aeetem se contulerunt et ab eo postulaverunt ut vellus aureum sibi traderetur. Ille cum audivisset quam ob causam Argonautae venissent, ira commotus est et diu negabat se vellus traditurum esse. Tandem tamen, quod sciebat Iasonem non sine auxilio deorum hoc negotium suscepisse, mutata sententia promisit se vellus traditurum, si Iason labores duos difficillimos prius perfecisset; et cum Iason dixisset se ad omnia pericula subeunda paratum esse, quid fieri vellet ostendit. Primum iungendi erant duo tauri specie horribili, qui flammas ex ore edebant; tum his iunctis ager quidam arandus erat et dentes draconis serendi. His auditis Iason etsi rem esse summi periculi intellegebat, tamen, ne hanc occasionem rei bene gerendae amitteret, negotium suscepit.	vīta -ae, f. [biography],cortices -um, m. [life-preserver],gradus citātus -ūs, m. [trot-noun]	Breviō intermissō spatiō, Lūcius ad equum suum appropinquāvit. Equus ā robore afflīctus erat, et Lūcius corticibus contendit ut eum servāret. Cum equō corticibus iūnctīs, parātus erat ad iter gradibus citātīs faciendum. Lūcius, vītam equī suī servāre volēns, nōn dubitāvit corticibus adiuvandum esse. Itaque, cum animō fortiōre, equum suum ad locum tūtum dūxit.	gpt-3.5-turbo-1106
EA quae secuta est hieme, qui fuit annus Cn. Pompeio, M. Crasso consulibus, Usipetes Germani et item Tencteri magna [cum] multitudine hominum flumen Rhenum transierunt, non longe a mari, quo Rhenus influit.	dominus nāvis -ī, m. [ship-owner],manūs iunctae -uum, f. [folded-hands],pepsīnum -ī, n. [pepsin]	Quīntenīus, dominus nāvis, cum manūs iunctās haberet, dē pepsīnō suō trīstis et cūrīsus sēnsit. "Quid faciam?" rogāvit. "Nāvis mea in perīculō est et nūllam spem vidēre vidētur." Tum in mente suā dēcēpitur. "Sed cūrī nōn nautae mē adiuvābunt?" inquit sēcum. Igitur, cum auxilium petīvisset, sociī eī auxiliō vēnērunt. „Quid tibī cum pepsīnō, frāter?“ statim rogātus est Cantius, unum ex nautīs. "Ēheu!" respondit Quīntenīus, "nāvem meam salvāre volō." Tum sociī haesitātēs fundere coeperunt, Quīntenium hortātī. "Nōn perībunt," inquit Cantius. "Nautae sociīque tē adiuvābunt." Itaque, cum id audīvisset, Quīntenīus māgnō animō ad nāvem rediit. Non sōlum auxilium accēpit, sed etiam sociīs grātiās ēgit, quod fortūnam suam cūrāvissent. ####	gpt-3.5-turbo-1106
Postquam ea tota nocte remis contenderunt, postridie ad terram ignotam navem appulerunt. Tum, quod naturam eius regionis ignorabat, ipse Ulixes cum duodecim e sociis in terram egressus loca explorare constituit. Paulum a litore progressi ad speluncam ingentem pervenerunt, quam habitari senserunt; eius enim introitum et natura loci et manu munitum esse animadverterunt. Mox, etsi intellegebant se non sine periculo id facturos, speluncam intraverunt; quod cum fecissent, magnam copiam lactis in vasis ingentibus conditam invenerunt. Dum tamen mirantur quis in ea sede habitaret, sonitum terribilem audiverunt, et oculis ad portam tortis monstrum horribile viderunt, humana quidem specie et figura, sed ingenti magnitudine corporis. Cum autem animadvertissent monstrum unum oculum tantum habere in media fronte positum, intellexerunt hunc esse unum e Cyclopibus, de quibus famam iam acceperant.	meiōsis -is, f. [meiosis],nāvis longa -is, f. [battleship],caput -itis, n. [chapter]	Postquam tota nocte remigantes contenderunt, maiores dormierunt. Postridie ad terram ignotam nāvis longa appulit. Tum, quod naturam eius regionis ignorabat, ipse Alexandrus cum duodecim e sociis in terram egressus loca explorare constituit. Paulum a littore progressi ad speluncam ingentem pervenerunt, quam habitari senserunt; eius enim introitum et natura loci et manu munitum esse animadverterunt. Mox, etsi intellegebant se non sine periculo id facturos, speluncam intraverunt; quod cum fecissent, magnam copiam lactis in vasis ingentibus conditam invenerunt. Dum tamen mirantur quis in ea sede habitaret, sonitum terribilem audiverunt, et oculis ad portam tortis monstrum horribile viderunt, humana quidem specie et figura, sed ingenti magnitudine corporis. Cum autem animadvertissent monstrum unum oculum tantum habere in media fronte positum, intellexerunt hunc esse unum e Cyclopibus, de quibus famam iam acceperant.	gpt-3.5-turbo-1106
Dum hic moratur, Hercules magnum incommodum ex calore solis accipiebat; tandem igitur ira commotus arcum suum intendit et solem sagittis petiit. Sol tamen audaciam viri tantum admiratus est ut lintrem auream ei dederit. Hercules hoc donum libentissime accepit, nullam enim navem in his regionibus invenire potuerat. Tum lintrem deduxit, et ventum nactus idoneum post breve tempus ad insulam pervenit. Ubi ex incolis cognovit quo in loco boves essent, in eam partem statim profectus est et a rege Geryone postulavit ut boves sibi traderentur. Cum tamen ille hoc facere nollet, Hercules et regem ipsum et Eurytionem, qui erat ingenti magnitudine corporis, interfecit.	supercilium -ī, n. [eyebrow],lucta carātica -ae, f. [karate],vitreārius -ī, m. [glassblower]	Puero nomine Gaius erat supercilium valde pulchrum, quod multos spectatores ad luctam carāticam hortabatur et mirabantur. Gaius autem, non solum luctator, sed etiam vitreārius erat. In officina sua, Gaius auro purpureaque vitra mirabiliter conficiebat. Quidam diēbus, Gaius ad ludum luctae carāticae contendit, ibi enim multi incolae spectavērunt eius ingenium et fortem animum. Post luctam, Gaius cum aliis luctatoribus colloquebatur, qui mirati sunt pulchritudinem vitri quod Gaius in officina sua confēcerat. Ita Gaius non solum propter suam virtutem in lucta carātica, sed etiam propter vitria pulchra, incolās regionis suae mirabant et admirabantur.	gpt-3.5-turbo-1106
[Eorum una, pars, quam Gallos obtinere dictum est, initium capit a flumine Rhodano, continetur Garumna flumine, Oceano, finibus Belgarum, attingit etiam ab Sequanis et Helvetiis flumen Rhenum, vergit ad septentriones.	hortus sub vitrō clausus -ī, m. [greenhouse],cōnsistorium -ī, n. [cabinet],genetīva nota -ae, f. [birthmark]	Pars eōrum, quī hanc fābulam audient, inter clāmus est duo frātrēs, Valerius et Lucius. Valerius est vērum amātōrem hortōrum sub vitrō clausō, ubi audācia flōrēs tām bella cōnspecuit. Clārā genetīvā nōtā super ōculō, Valerius semper amābat spectāre flōrēs sub radiīs sōlis. Lucius autem erat in cōnsistōriō nōbili, ubi litterīs māgnīs et cōnsiliīs sapientibus cōnsulēbātur. Valerius saepe invitābat Lūcium ad suum hortum, ut pulchrōs flōrēs spectāret, sed Lūcius semper negābat. "Spectāre flōrēs," inquit, "nōn est grātum. Sed scrībere et cōnsiliārī est meae rēs." Valerius tamen semper voluit Lūcium ad hortum trahere, sīc ut frāter suus pulchrōs flōrēs amāret. Umberā valdē ardentē solis, Valerius tandem hortum suum clausum aperuit, et Lūcius advenit. "Nunc," inquit Valerius, "flōrēs pulchrīs vidēs, ut nōn numquam vidērēs." Lūcius, sub radiīs sōlis, genetīvam nōtam super ōculō Valerī vīdit. "Quid est istud?" rogāvit. Valerius sēsē risit, "Hic est genetīva nōta mea. Semper laudō eam, quod spectō flōrēs. Nunc tū etiam pulchrōs flōrēs vidēre possis." Tunc Lūcius cognōvit, quod Valerius cum hortō valdē contendere, utrum cōnsistoriō sapientiam an hortōs sub vitrō clausō amābilior esset. Sed ex vultu Lūcī vīdit, quōs flōrēs tām pulchrīs spectāret Valerius, cor eius ad hortōs patefēcit. Post diem ūnum, Lūcius in hortō sub vitrō clausō Valerī pulchrōs flōrēs spectāvit. Et Valerius in cōnsistōriō Lūcī sapientiā frūctum lēgit. Eīliciter cōnstat, quod inter frātrēs, quī in vītā dissimilēs sunt, amicitia semper vincit. ####	gpt-3.5-turbo-1106
 At Caesar, etsi nondum eorum consilia cognoverat, tamen et ex eventu navium suarum et ex eo quod obsides dare intermiserant fore id quod accidit suspicabatur. Itaque ad omnes casus subsidia comparabat. Nam et frumentum ex agris cotidie in castra conferebat et, quae gravissime adflictae erant naves, earum materia atque aere ad reliquas reficiendas utebatur et quae ad eas res erant usui ex continenti comportari iubebat.	glandulae genitāles -ārum, f. [gonads],globulus perforātus -ī, m. [bead],galēriculum -ī, n. [hat]	Galēriculum Lūcius habēbat, quam in diēbus ēbullientibus ad omnia capienda ūtiliter ūtebātur. Lūcius omnēs locīs ībant, etiam in hortō ubi glandulae genitāles rosī erant. Hī glandulī magnī erant, quae semper sēsellēs erant. Lūcius semper eās in manū suā tenēbat et globulōs perforātōs cum eīs faciēbat, quam in saeptum suum strexit. In diē quōdam, Lūcius in lūdō pīlārum spectandō erat, cum subitō ventus forti tenācitātem ēripiēns glōbulōs eius aufert. Lūcius perterritus adjuvīcās quaerēbat, sed nūllōs prōximēs inveniēbat. Tum, mīrō cōnsiliō impulsus, ad ulmum adscendit, ubi glōbulōs suōs in rāmōs pendēbant. Mīrā fīdē virgae sē tenēbant, et Lūcius ea cum gaudio recēpit. Ex hōc fābulāculō discimus nōn sōlum ōrdinem verborum et rēctam cōnstructiōnem, sed etiam īnventīvārum mēnsurās valdē laudārī posse.	gpt-3.5-turbo-1106
Eurystheus postquam boves Geryonis accepit, laborem undecimum Herculi imposuit, graviorem quam quos supra narravimus. Mandavit enim ei ut aurea poma ex horto Hesperidum auferret. Hesperides autem nymphae erant quaedam forma praestantissima, quae in terra longinqua habitabant, et quibus aurea quaedam poma a Iunone commissa erant. Multi homines auri cupiditate inducti haec poma auferre iam antea conati erant. Res tamen difficillima erat, namque hortus in quo poma erant muro ingenti undique circumdatus erat; praeterea draco quidam cui centum erant capita portam horti diligenter custodiebat. Opus igitur quod Eurystheus Herculi imperaverat erat summae difficultatis, non modo ob causas quas memoravimus, sed etiam quod Hercules omnino ignorabat quo in loco hortus ille situs esset.	tructa -ae, f. [trout],scrobiculus -ī, m. [golf-course-hole],stercus -oris, n. [fertilizer]	Herculēs, magnus herōs, sēcum dūxerat suum fidēlem amīcum, Valerium, in agrōs ad piscandum. Valerius, pīscātor perītus, in flūmine tructam magnam cepit. Tructa, cum esset pūlchrī lūcīs et formae, ad flūmen longē spectāvit. "Tibi grātiās agō, amīce," inquit Valerius, "quoniam haec tructa est prīnceps inter cēterās omniae idōnea ad cēnandum." Herculēs, Valerī dīxerat, "Nunc tempus est patere hunc locum tibi." Valerius autem vultum festīnātē vertit, "Nōn, amīce, sed nunc tempus est mihi spēluncam in saxō cōnspicere. Inveniō enim locum idōneum ubi dē golfīscō scrobiculō parāre possim. Opus nimis grave est, quis mē iuvābit?" Herculēs rīsit, et inquit, "Vereor nōn posse valdē adsit." Valerius tamen contentus in saxō scrobiculum nōn sine miseriā suā rūrsus cōnspexit. "Locum, amīce, mīhi ostendis ubi stercus poterit esse?"	gpt-3.5-turbo-1106
Orta luce Polyphemus iam e somno excitatus idem quod hesterno die fecit; correptis enim duobus e reliquis viris carnem eorum sine mora devoravit. Tum, cum saxum amovisset, ipse cum pecore suo ex spelunca progressus est; quod cum Graeci viderent, magnam in spem se post paulum evasuros venerunt. Mox tamen ab hac spe repulsi sunt; nam Polyphemus, postquam omnes oves exierunt, saxum in locum restituit. Reliqui omni spe salutis deposita lamentis lacrimisque se dediderunt; Ulixes vero, qui, ut supra demonstravimus, vir magni fuit consili, etsi intellegebat rem in discrimine esse, nondum omnino desperabat. Tandem, postquam diu haec toto animo cogitavit, hoc consilium cepit. E lignis quae in spelunca reposita erant palum magnum delegit. Hunc summa cum diligentia praeacutum fecit; tum, postquam sociis quid fieri vellet ostendit, reditum Polyphemi exspectabat.	(Darviniana) animantium per gradūs mūtātiō -ōnis, f. [evolution],taberna -ae, f. [booth],psittacus -ī, m. [parrot]	Cum in taberna quadam antiqua, Marcus, Iulia et Flavius animantium per gradūs mūtātiō spectabant. In taberna erant multi parrots, qui linguam humanam imitabantur. Inter parrots unus erat pulcherrimus, qui nomina "Aurelius" habebat. Tres amici cum admiratione parrotum spectaverunt, sed subito psittacus Aurelius consilium cepit. "Ave, amici!" clamavit Aurelius. "Scio consilium optimum! Polyphemum, quem in carmine Virgili īnfelicem habemus, superare possumus. Si iūcundum pānem eī dederimus, eiēctus in hortum omnia ovīs ex delectō speluncā sequestrabit, et facultāte adītūs sabbātī anīmālium annectendō nūllam magnam fortiātiōnem patiētur. Quid dicis?" Amici stupefacti Aurelio asquieverunt, tamen susurrius inter sē consultabant. "Num scitūrus est?" sūstinebant. "Tentābimus," Flavius finaliter respondit. Et tamquam in conspectum Polyphemi animantium per gradūs mūtātiō spectaculum experiēbantur triumvirī Romānī.	gpt-3.5-turbo-1106
 Pro his Diviciacus (nam post discessum Belgarum dimissis Haeduorum copiis ad Cum reverterat) facit verba: Bellovacos omni tempore in fide atque amicitia civitatis Haeduae fuisse; impulsos ab suis principibus, qui dicerent Haeduos a Caesare in servitutem redacto. omnes indignitates contumeliasque perferre, et ab Haeduis defecisse et populo Romano bellum intulisse. Qui eius consilii principes fuissent, quod intellegerent quantam calamitatem civitati intulissent, in Britanniam profugisse.	vīnum Astense Hispanicum -ī, n. [sherry],harēna lūbrica (v. gelida) -ae, f. [rink],statiō (v. portus) lūsoriārum -ōnis, f. [marina]	Quintus, iuvenis studiōsus, in statiōne lūsoriārum frequenter ad harēnam lūbricam gelidam (rink) vīnum Astense Hispanicum (sherry) bibit et ludos spectat.  Una die, Quintus in statiō lūsoriārum sedet et vīnum suā manū habet. Subitō, harēna lūbrica gelida sub plantīs eius movetur et Quintus exspectat, quemadmodum lūsorēs habilēs in lūdīs ēiusmodī se gerant.  Tum, ōlim in Britanniam antīquam properant, addūcuntur ad portum nāvēs bellōvaceās, quibus lūsorēs fortēs et audācēs super mare profectūrī sunt. Etiam si perīcula ingentia timeant, nōn dubitant ad spectandam pugnam vēnīre. Quintus, quī nūntium clārissimī bellī memor est, cum harēnam lūbricam spectat, māgnopere de audāciā et virtūte haec spectācula commovētur. Itaque postea, ipse virtūtem suam in lūdere et vīnam Hispanicam Astensem gustandam cōnābitur, sīc ut fortēs lūsorēs in Britanniam antīquam. ####	gpt-3.5-turbo-1106
Gens Amazonum dicitur omnino ex mulieribus constitisse. Hae summam scientiam rei militaris habebant, et tantam virtutem adhibebant ut cum viris proelium committere auderent. Hippolyte, Amazonum regina, balteum habuit celeberrimum quem Mars ei dederat. Admeta autem, Eurysthei filia, famam de hoc balteo acceperat et eum possidere vehementer cupiebat. Eurystheus igitur Herculi mandavit ut copias cogeret et bellum Amazonibus inferret. Ille nuntios in omnis partis dimisit, et cum magna multitudo convenisset, eos delegit qui maximum usum in re militari habebant.	liber compactus -ī, m. [bound-book],ratis -is, f. [raft],trabs -is, f. [rafter]	In urbe quaedam, faber nauticus nomine Gaius habitabat. Gaius liberum compactum maxime amabat, quod in eo multas fabulas et argumenta mirabilia reconditae erant. Tandem, tempore pluvioso, flumen ingens in proxima via effudit. Gaius, qui ad mare vicinum habitabat, ad natandum ratem oportuit conficere. Itaque, trabes robustas ex lignis aptis electas raptim coniunxit. Hic labor ei molestus videbatur, sed, postquam raptores ex adventu incolarum periculo aestimavit, ad natandum adiutorem rati potius quam liber compactum adpellavit.	gpt-3.5-turbo-1106
 Ad haec Caesar respondit: se magis consuetudine sua quam merito eorum civitatem conservaturum, si prius quam murum aries attigisset se dedidissent; sed deditionis nullam esse condicionem nisi armis traditis.	saeptum -ī, n. [lock-sluice],mixtura -ae, f. [hybrid],gubernāculum -ī, n. [rudder]	Lucius ad flumen ambulabat, ubi saeptum videbat. In saepto aqua magna mixtura fluit, quod admira gens hybrida es. Lucius curiosus est, et ad saeptum appropinquat ut videat, quid sit. Tum, subito gubernaculum desperatum in saepto videat! "Quomodo haec ibi venit?" rogat Lucius. Itaque, Lucius de saepto ad casam properat et patrem, qui est faber, adiuvat. Patris auxilio, gubernaculum e saepto eruit. "Magnus est inventus!" clamavit Lucius gaudio plenus.	gpt-3.5-turbo-1106
Quibus omnibus rebus permoti equites Treveri, quorum inter Gallos virtutis opinio est singularis, qui auxilii causa a civitate missi ad Caesarem venerant, cum multitudine hostium castra [nostra] compleri, legiones premi et paene circumventas teneri, calones, equites, tunditores, Numidas diversos dissipatosque in omnes partes fugere vidissent, desperatis nostris rebus domum contenderunt: Romanos pulsos superatosque, castris impedimentisque eorum hostes potitos civitati renuntiaverunt.	margarīta -ae, f. [jewelrypearl],sēlectio (generatōria) -ōnis, f. [breeding-selective],pictūra aquāria -ae, f. [watercolor]	In oppido quodam, notus "Dominicus" dicabatur, qui spe agresti mercaturam margaritarum exercuit. Dominicus, vir ingeniosus et peritus, semper novas creavit speciales selectiones margaritarum, quarum magnitudinem, formam, et colorem diligenter consideravit. In horto suo, ubi magna solarium erat, Dominicus margaritas diversas spectavit et inter se comparavit, ut optimas et perfectas margaritas eligeret. Ab amico rogatus, Dominicus picturam aquariam elegantem magnopere desiderabat. Itaque, pro amico suo, Dominicus aquam, formam, et colorem accurate examinavit, ut pulchram et memorabilem picturam crearet. Per multas horas laboravit, aquam et colores miscens, donec pictura aquaria magnifice completa erat. Omnibus his actis peritis, Dominicus non modo margaritas elegit, sed etiam picturam aquariam perfecit, omnibus suam artem manumque ingeniosam demonstrans. Tale exemplum ingeniī et peritiās Dominici discipuli edocti sunt, qui a creativitate et diligentiā eī plurimum supportati sunt. ####	gpt-3.5-turbo-1106
