 His rebus cognitis Caesar Gallorum animos verbis confirmavit pollicitusque est sibi eam rem curae futuram; magnam se habere spem et beneficio suo et auctoritate adductum Ariovistum finem iniuriis facturum.	puppis -is, f. [bridge],ascaris -idis, f. [roundworm],(venēnum) pesticidale -is, n. [pesticide]	In aedibus modernis, Iulia, puella studiosa, quotidianam vitam agit. Die quodam, Iulia notitiam perhibuit de ascaride quae in horto suo reperta fuerat. Hortus, ubi flores multicolores crescebat, nunc verme terribili vexabatur, quo nullus flos intactus manebat. His rebus compertis, Iulia deliberavit remedium invenire. "Oportet," inquit, "hoc venēnum pesticidale emere, quo ascaris perire possit. Sed quo pacto salutem florum garantiam?" Iulia ad tabernam puppis, quae multa venena pesticide vendebat, contendit. Solummodo vestigium pontis transiit et tabernae ianuam aperuit, avide sollicitans consilium. "Mihi opus est veneno pesticidali quod ascarides necet, sed plantis non noceat," Iulia praefecto tabernae exposuit. Vir ille, gnarus rerum hortensium, ponderata consilia praebuit. "Dabo tibi venenum," inquit, "quod ascarides interficiet sine dubio, sed flosculos tuos non laedet. Prudenti usui indigebit, ne flumen aut terra contaminetur." Iulia veneno accepto, hortum suum curavit, ascaridemque non amplius vidit. Insequenti vero die, flores eius, liberati ab ascaride, pulchrius quam ante florebant. "Quam magnum beneficium," inquit Iulia, "quod scientia et prudens consilium naturam servare possint. Oportebit nos semper meminisse de usu rei cuique et de naturae respectu."  Et floribus suaviter fragrantibus, Iulia sensum responsabilitatis novum in pectore suo hausit.	gpt-4-1106-preview
 Palus erat non magna inter nostrum atque hostium exercitum. Hanc si nostri transirent hostes expectabant; nostri autem, si ab illis initium transeundi fieret, ut impeditos adgrederentur parati in armis erant.	scapha pedalicia -ae, f. [pedal-boat],porta -ae, f. [goal-football],bibliopega -ae, m. [bookbinder]	Aulus, bibliopega peritus, dies festos cum familia sua agere decreverat. Ad mare profecti sunt, ubi scaphae pedaliciae ad litora pulchrae insulae paratae erant. Aulus, plenus cupiditatis, primus scapham conscendit, uxorem filiamque vocans ut secum fluctus placidos peterent. Navigantes hilares, prope portam magnam in arena factam venerunt, qua pueri ludentes pila ludum agitabant. Exclamavit Aulus: "Ecce porta! Num ludum spectemus, o dulcissimae animae?" Et cum illae consensissent, scapham ad littus reduxerunt, spectaculum praesto esset. Dum ludum intente spectant, unus ex pueris pilam procul a porta misit et directe in librum quem Aulus legebat. Puer, timens bibliopegam iratum fore, ad Aulum cucurrit ut veniam peteret. Aulus vero, risu movente, puerum adiuvit et de librorum amore verba facunda locutus est. "Habetis," inquit Aulus, "beneficium librorum. Quisque per hos novi mundi et antiqui historiae discuntur. Etsi nunc ludis et recte facis, aliquando fortasse tu etiam bibliopega fias!" Ridens, puer pollicitus est se etiam futurum tempore libros magno cum amore tractaturum, ut Aulus faciebat. Tum, cum pila recepta, ad sodales rediit, et ludus iterum coepit. Aulus et eius familia, postquam ludum finitum esse viderunt, scaphae pedaliciae iterum ascenderunt, vespertinum caelum laeti spectantes, felicita pleni.  Qua in die, non tantum delectationem sed etiam doctrinam Aulus suis praebuerat, monens et exemplum se praestans futuris bibliopegis et cultoribus litterarum.	gpt-4-1106-preview
Novem dies secundissimo vento cursum tenuerunt, iamque in conspectum patriae suae venerant, cum Ulixes lassitudine confectus (ipse enim gubernabat) ad quietem capiendam recubuit. At socii, qui iam dudum mirabantur quid in illo sacco inclusum esset, cum ducem somno oppressum viderent, tantam occasionem non omittendam arbitrati sunt; credebant enim aurum et argentum ibi esse celata. Itaque spe lucri adducti saccum sine mora solverunt, quo facto venti "velut agmine facto qua data porta ruunt, et terras turbine perflant."Hic tanta tempestas subito coorta est ut illi cursum tenere non possent sed in eandem partem unde erant profecti referrentur. Ulixes e somno excitatus quo in loco res esset statim intellexit; saccum solutum, Ithacam post tergum relictam vidit. Tum vero ira vehementer exarsit sociosque obiurgabat quod cupiditate pecuniae adducti spem patriae videndae proiecissent.	nautica pyxis -idis, f. [compass-magnetic],Corānus -ī, m. [koran],campus pedifoliī -ī, m. [soccer-field]	In urbibus modernis, ubi aedificia altissima ad caelum tendunt et luminum nocturnorum splendor tenebras vincit, est campus pedifoliī vastus et celeber, ubi pueri puellaeque arte ludicra contendunt. Inter eos erat Iulianus, iuvenis agilis et pedifolio deditus, qui magnam partem diei in campis decertabat. Quamquam Iulianus discipulus eruditus et in litteris Corāni versatus erat, maxima ex parte suum tempus cursu pilaque in campestribus areis agebat. Pater eius, vir sapientiae plenus et nauticae peritus, saepe eum monebat ut studiis gravissimis et vitae disciplinis operam daret. Cui Iulianus respondit: "O pater carissime, ego certe philosophiae et scripturis sacris operam do, sed etiam in ipso pedifolii ludo multa discere possumus, ut cooperationem, disciplinam, et fortitudinem." Die quodam, cum caelum serenum esset et sol splendidus campo pedifoliī lucebat, Iulianus cum amicis pedifolium ludens calamitatem inexplicabilem expertus est. Repente ventus vehemens surgeret, et pila, quam fortissime percutierat, in nubes altae sublata est, nusquam conspicienda. Vexati et sine consilio, pueri instrumentum quaererent quod eos ad pili locum reconditum duceret. Tunc fortuna adiuvante, pater Iuliani, vir peritissimus nauticae, venit secreto instrumento, quod nautica pyxis vocatur. "Vide", inquit, "hanc pyxidem magneticam, quae nos ad rectam plagam diriget ubi nostra amissa res inventa potest." Omnes ad instrumentum admirabantur, quod non solum in nauticis sed etiam in lusoriis usibus tanta utilitate fruerentur. Pater ergo pyxidem in manibus tenebat et precisione mirabili pueris monstravit quomodo venti directionem et pilae situm per hanc miram technologiam invenire posset. Post brevem tempus, pyxidis indagine, invenitur pila iuxta alium campum pedifoliī, ubi alii iuvenes ludum exercebant. Iulianus et amici gratias patris egerunt, qui risit et eos monuit ut huius rei memores essent: "Nulla res est tam humilis aut lusoria, quin ei scientiam et rationem adhibere possimus. Estote studiosi et ludite, sed numquam obliviscimini utrumque vitae aspectum - ludum et disciplinam - in perfecto equilibrio tenere debere." Et sic Iulianus, instructus et a pater doctus, in campis pedifoliī arte ludicra et sapientibus praeceptis crescebat, certus iam scientiam et ludum hand disparia sed vitae complementa esse.	gpt-4-1106-preview
Coniurandi has esse causas: primum quod vererentur ne, omni pacata Gallia, ad eos exercitus noster adduceretur; deinde quod ab non nullis Gallis sollicitarentur, partim qui, ut Germanos diutius in Gallia versari noluerant, ita populi Romani exercitum hiemare atque inveterascere in Gallia moleste ferebant, partim qui mobilitate et levitate animi novis imperiis studebant; ab non nullis etiam quod in Gallia a potentioribus atque iis qui ad conducendos homines facultates habebant vulgo regna occupabantur; qui minus facile eam rem imperio nostro consequi poterant.	index (librī) -icis, m./f. [title-page],meteoron -ī, n. [meteor],crepida -ae, f. [sandal]	In hac historia moderna narrabimus de Martino, iuvene discipulo, qui admodum studebat astronomicis mysteriis. Una nocte, cum caelum spectaret, meteoron praeclarum vidit, cuius lumen per obscuram noctem scintillabat. Miratus hoc celeste spectaculum, Martius vehementer cupiebat plura de sideribus discere. Die insequenti, bibliothecam petiit, ubi librum de astronomicis phenomenis quaerere coepit. Cum autem index rerum libro de meteoris investigandum esset, librarius eum adiuvare decrevit. "Martine," librarius inquit, "index multa indicia continet. Titulos accuratos tibi monstrare potest." Librarium sequens, ad repositorium venerunt ubi volumen cuius index 'De Meteoris Observationibus' erat reperiebatur. Martius, libri indice perlecto, omne scire de astris desiderabat et statim legendum coepit. Lectio finita, domum Martius magno passu rediit, cogitans de meteororum origine et natura. Aspiciens crepidas suas, sordidis viarum pulvereis maculatas, Martius reputavit quam parvus esset homo compare cum immensitate caeli. Nam, sicut crepida in itinere protegit pedem viatoris, sic scientia eius de meteoron mysteriis animam eius a nescientiae tenebris protegere poterat. Reflexione consummata, Martius statuit meteororum studium non solum ad mentem, sed etiam ad animam colendam utilissimum esse. Possessas scientias in schola et inter amicos communicaturus erat, sperans ut alii eadem admiratio caelorum caperet quae ipsum ceperat. Sic index libri non finem, sed novi itineris exordium Martio praebuerat, ita ut crepida viatorum non terminum viae, sed vias novas explorare iuvat.	gpt-4-1106-preview
 His nuntiis litterisque commotus Caesar duas legiones in citeriore Gallia novas conscripsit et inita aestate in ulteriorem Galliam qui deduceret Q. Pedium legatum misit. Ipse, cum primum pabuli copia esse inciperet, ad exercitum venit. Dat negotium Senonibus reliquisque Gallis qui finitimi Belgis erant uti ea quae apud eos gerantur cognoscant seque de his rebus certiorem faciant. Hi constanter omnes nuntiaverunt manus cogi, exercitum in unum locum conduci. Tum vero dubitandum non existimavit quin ad eos proficisceretur. Re frumentaria provisa castra movet diebusque circiter XV ad fines Belgarum pervenit.	perdix -īcis, m./f. [partridge],cetaceum -ī, n. [spermaceti],verba marginī adscrīpta -ōrum, n. [marginal-note]	In urbe moderna, Magister Iulianus discipulos suos hortatur ut naturae et scientiae mirabilia perdiscant. Hodie, lectionem de animalibus et substantiis raris habet. In tabula, imagines variae et notae marginales apparent, quae discipulorum animos incitant. "Perdicem videtis," inquit Iulianus, monstrans avem pulchram in imagine depictam. "Avis est agrestis, quae in sylvis et campis reperitur. Bonus enim gustus est perdici carbōnātae!" Discipuli ridere incipiunt, quippe qui sciant Magistrum Iulianum semper iocos inter seria miscere solere. Praeterea, Magister Iulianus cetaceum praesentat, substantiam albam et candelis utilem, quae a physetere, magno mari monstro, orta est. "Antiquis temporibus," explicat, "cetaceum ad lucernas et unguenta paranda valebat. Hodie vero, scientia provecta, aliis in rebus utilis est, ut in pharmaceuticis et cosmeticis." Repente, Iulia, discipula curiosa, manum levat et rogat, "Magister, quid sunt haec verba margini adscripta iuxta cetacei picturam?" Omnes in tabulam intenti sunt. "Optima quaestio, Iulia!" Magister Iulianus respondet. "Sunt notae quas docti adscribunt ut lectores sine errore discant. Singulis marginibus criticis utimur ad discendi viam faciliorem reddendam, veluti hīc explicātum est cetacei in natura locum et usum." Discipuli, lectis verbis margini adscriptis, novam scientiam adepti sunt et gratias Magistro egerunt. Lectione finita, Iulianus eos monet ut semper curiosi sint, naturae arcana persequantur, et nunquam desistant a discendo, sicut olim et nostri maiores fecerunt. Et sic finitum est, laetitia et sapientia in puerorum puellarumque animis seminata.	gpt-4-1106-preview
Paulo post iussus est ab Eurystheo Hydram necare. Hoc autem monstrum erat cui novem erant capita. Hercules igitur cum amico Iolao profectus est ad paludem Lernaeam, in qua Hydra habitabat. Mox monstrum invenit, et quamquam res erat magni periculi, collum eius sinistra prehendit. Tum dextra capita novem abscidere coepit; quotiens tamen hoc fecerat, nova capita exoriebantur. Diu frustra laborabat; tandem hoc conatu destitit. Deinde arbores succidere et ignem accendere constituit. Hoc celeriter fecit, et postquam ligna ignem comprehenderunt, face ardente colla adussit, unde capita exoriebantur. Nec tamen sine magno labore haec fecit; venit enim auxilio Hydrae cancer ingens, qui, dum Hercules capita abscidit, crura eius mordebat. Postquam monstrum tali modo interfecit, sagittas suas sanguine eius imbuit, itaque mortiferas reddidit.	sphyraena -ae, f. [baracuda],index (rērum v. contentōrum) -icis, m./f. [table-of-contents],pōtiō mixta Hispanica -ōnis, f. [sangria]	Gaius, iuvenis studiosus, magnam piscationem cum patre in aquis maris Caribici ardentibus apparebat. Horis matutinis sole leniter surgente, navem parvam secum et patrem deduxerunt usque ad locum, in quo sphyraenae multae esse dicebantur. Piscationis ars Gaium numquam defecit; nam artificia et dolos generis huius piscandi a patre didicerat. Sed in tabula indicis rerum piscatorii fructuum, quae ad puppim navi affixa erat, nomen 'sphyraena' in lineis primis videbitur. Etsi periculosum animal est et venusta, captura eius gloriae causa erat. Non diu in altum mare afuerunt, cum turbas piscium circum naviculam cernere. Gaius sciscitabatur an sphyraena ibi esset. Non cunctando, hamo et fune praeparato, spe magni triumphi in aquam mersist. Interim pater potionem mixtam Hispanicam iucunde parabat, qua calor diurnus leniretur et victoria celebraretur. Vinum rubrum, sucum citreorum, fructus varii et paululum sacchari, omnia miscuit. Potionis flagrantis odore in auras diffuso, Gaius capturam suam ducebat. Ecce! Linea tensione maxima subito se extendit. Gaius, viribus omnibus contendens, sphyraenam magnam et ferox ex aquis traxit. Piscis, sole illustratus, splendebat et in navem rapidus saliebat. Pater, reiecta potione, adiutum filium properavit. Victoria Gaii cum laetitia salutabatur. Post campestres luctus et sudores, pater filiumque ad litus revertebantur, ubi pretiosa piscium delectatio et delectamentum potionis Hispanicae eos manebat. Animo grato, eventos diei commemoraverunt – die in quo sphyraena, indicis piscatorii gloriosum nomen, et potio mixta Hispanica, dulcedinis et societatis symphonia, in memoria eorum perhennem locum invenerunt.	gpt-4-1106-preview
Perseus igitur multos annos ibi habitabat, et cum matre sua vitam beatam agebat. At Polydectes Danaen magnopere amabat, atque eam in matrimonium ducere volebat. Hoc tamen consilium Perseo minime gratum erat. Polydectes igitur Perseum dimittere constituit. Tum iuvenem ad se vocavit et haec dixit: "Turpe est hanc ignavam vitam agere; iam dudum tu adulescens es. Quo usque hic manebis? Tempus est arma capere et virtutem praestare. Hinc abi, et caput Medusae mihi refer."	tabulātum -ī, n. [floor-level],urea -ae, f. [urea],pōns is, m. [gangplank]	In nostra aetate, iuvenis nomine Iulius, chemist nulla peritia, laboratorium visitabat. Pulcherrimum tabulātum superiōre in aedificio ascendit ubi experimenta mirabilia fiebant.  Dum ambulabat, nolens fatum tentare, pōntem aditus ingredientibus positum circumspecte transibat. Praeclara magna arte fabricati pōntis super pavimenta dūrae ureae strata, qua scientiae amatores ad loca secreta laboratorium transire possent. Subitō, Iulius periculose prope extremum pōntis evertit, paene in abyssum tabulāti infra iacentis cecidit. "O me miserum!" exclamavit Iulius, corde tremente. "Quanta est haec urea periculosa!" Astūte cogitavit et meminērat lectionum pristinarum: "Urea vehemens est, et iustā cum aquā temperāta tutiōrem facit." Statim, prope se aquarum fontem vidit et modicum aquae in periculosum locum fudit. Mira fit res: Urea paulatim mollita est, securiusque Iulius iter facere potuit. Vita eius servata erat, et non solum! Iulius, perspicaci ingenio usus, novum modum invenerat ad tabulāta laboratorium sine periculo traversandi. "Haud opus est nobis magno scientiarum peritō," Iulius in alto animo cogitavit. "Interdum simplicitas et cautela potior est." Sic finitur fabula nostra, docens nos cum peritiā insightem quam cum insolentiā agendum esse, et in quavis tabulati et pontis difficultate prudentiam esse optimum ducem.	gpt-4-1106-preview
Perseus igitur multos annos ibi habitabat, et cum matre sua vitam beatam agebat. At Polydectes Danaen magnopere amabat, atque eam in matrimonium ducere volebat. Hoc tamen consilium Perseo minime gratum erat. Polydectes igitur Perseum dimittere constituit. Tum iuvenem ad se vocavit et haec dixit: "Turpe est hanc ignavam vitam agere; iam dudum tu adulescens es. Quo usque hic manebis? Tempus est arma capere et virtutem praestare. Hinc abi, et caput Medusae mihi refer."	castor -oris, m. [beaver],magister (v. praefectus) nāvis -ī, m. [captain],curriculum (v. iter) narticum -ī, n. [ski-slope]	In temporibus modernis, sermone Latino inter scholasticos adhuc vigente, puer nobilis nomine Sextus, magnae industriae et virtutis erat. Sextus enim, non solum in litteris, sed etiam in nartatione excellere cupiebat. Cum prima nivis tessera montium cacumina almam vitam nartantium amplexa essent, Sextus se ad locum narticum, ubi illustre curriculum situm erat, contulit. Iuvenis corpus exercitum paratoque animo ad ludum hiemalem descendendum instituebat. In proximo flumine amnis, egregius castor conspicatus est, labori et architecturae deditus. Castor -oris, ramis et caespite agiliter utitur, molendinum aquarum ingeniose struens. Sextus animali in suo opere intento non ingrediebatur, quin potius naturae opera mirabatur. Mox ad curriculi nartici initium pervenit. Ibi magnus vir et peritus, magister navis et curriculum pronuntians, stetit. Magister -navis Sextum allocutus est: "Audacter procede, sed memento artis disciplinam te traditurum esse. Non solum celeritate, sed etiam diligentia iter absolvi oportet." Sextus, salutem pedibus firmam gerens, cursum sui nartici laetus incepit. Ad summam venuste et scientia, tanquam navis per turbidum mare ducitur, per varios clivorum angustias et sinuositates se mittebat. Spectatores, tam puberes quam senes, eius destreitate capti, laetis clamoribus insequentes plaudebant. Descensus perficiens, Sextus ad magistrum accessit, qui acumine et sapientia ducis iuvenem laudabat. "Bene, Sexte!" exclamavit. "Non solum pedes, sed etiam animus in tuo descensu egit. Qualis castor in suo opere, ita tu in hoc cursu magnum ingenium ostendisti. Pergas et magis magisque te excolas!" Sextus, corde exultante et confisus, magistri verba recepit et certior futurus nartationis artis, in vitae cursum se iterum immisit, castoris labor et magistri navis praeceptum memorans.	gpt-4-1106-preview
[Eorum una, pars, quam Gallos obtinere dictum est, initium capit a flumine Rhodano, continetur Garumna flumine, Oceano, finibus Belgarum, attingit etiam ab Sequanis et Helvetiis flumen Rhenum, vergit ad septentriones.	unguis -is, m. [fingernail],statiō aëria -ōnis, f. [airfield],lūnae dēfectus -ūs, m. [lunar-eclipse]	In temporibus modernis, iuvenis nomine Gaius ad stationem aeriam properabat, nam in tempus ad suum volatum convenire volebat. Gaius fuit studiosus astronomiae, et idcirco ad distantem terram iter faciebat ut lunaedifectus spectaret. Die illo, caelum erat serenum et ventus leviter flabat, quod Gaius accepte ferebat, nam peritus aviationis erat, et bene sciebat quam turbatio quaevis tempestas volatus adferre posset. Tunicam pallidam et calceos altos gestabat, et manu valise leve ferebat. Dum per stationem aëriam ambulabat, aspectum aeroplanorum et volatum in caelo conspiciebat cum admiratione et gaudio. Ad tabulam nuntiationum accessit, oculis per indices volatus cursum capit. Subito, digitis suis - quibus longi unguis erant, more Romanorum antiquorum culti - in schedam temporis sui volatus pepigit, nam miro modo eam prope horam discessus non inveniebat. Inquietude percitus, ad adminiculos stationis properavit. Administrum autem, togam computatralem gestans, calme respondit, "Noli sollicitari, Gaiums; lunaedifectus hodie incipiens, omnia in caelo ita movet ut statio nostra modum temporis volatus paulo mutare coacta sit. Patientiam habe, volatus tuus differtur, sed certo discedet." Gaius, etsi parum sollicitus de mutatione, gratiam adminiculo egit et de amplitudine caeli et potentia siderum cogitare coepit. Cogitavit quoque de his qui olim tam magna de caelo et sideribus scire potuerant, quamvis technologyam modernam non haberent. Tandem, hora lunaedifectus approximante, Gaius in aëroportus tectum ascendit, ubi multitudinem hominum invenit. Homines undique terra veniebant, ut mirabile caeli spectaculum spectarent. Cum orbis terrarum in umbram mergitur et luna rubescente colore paulatim offuscatur, Gaius tamquam priscis Romanis se coniunctum sentit, qui eandem lunam et eius mutationes observarent. Nunc, stans in moderna statione aëria, idem admiratio et sensus communionis cum universo eum confirmat, sicut olim eum confirmavissent. #### Et sic Gaius, et arte nova de aëronavigatione et antiqua sapientia siderum motuumque peritus, iter facere pergit, semper meminisse praeceptum: in nesciencia, in contemplatione caeli, et in admiratione naturae, constanter discimus.	gpt-4-1106-preview
His rebus cognitis Medea rem aegre tulit, et regni cupiditate adducta mortem regi per dolum inferre constituit. Hoc constituto ad filias regis venit atque ita locuta est: "Videtis patrem vestrum aetate iam esse confectum neque ad laborem regnandi perferendum satis valere. Vultisne eum rursus iuvenem fieri?" Tum filiae regis ita responderunt: "Num hoc fieri potest? Quis enim umquam e sene iuvenis factus est?" At Medea respondit: "Me medicinae summam habere scientiam scitis. Nunc igitur vobis demonstrabo quo modo haec res fieri possit." Postquam finem loquendi fecit, arietem aetate iam confectum interfecit et membra eius in vase aeneo posuit, atque igni supposito in aquam herbas quasdam infudit. Tum, dum aqua effervesceret, carmen magicum cantabat. Mox aries e vase exsiluit et viribus refectis per agros currebat.	rūgae oculī -ārum, f. [crows-foot],(Darviniana) animantium per gradūs mūtātiō -ōnis, f. [evolution],praesaepe -is, n. [manger]	In aetate nostra novissima, in schola biologiae apud scientiarum fabricam, discipulus studiosus nomine Gaius operam dabat, ut mirabilia naturae intellegat. Praeceptor, homo gravitatis et scientiae, ad tabulam stetit et de (Darviniana) animantium per gradūs mūtātiōne disseruit. Ipse autem, fronte in rūgas oculī acta, per annos investigationes suas de evolutione prosecutus est. “Ecce,” inquit praeceptor, “sicut rerum natura animantium formas per saecula varias evolvit, ita nos homines scientiam nostram semper amplificare debemus.” Gaius cum admiratione magistri verba auscultabat, mente fervida cogitationibus novis. “Quomodo autem,” interrogavit Gaius, “variae species ad novum ambitum se accomodare possunt?” Praeceptor respondit, “Per mutationes geneticas et selectionem naturalem, speciebus novis iter semper aperitur. Quid mirum, quod avis ex praesaepibus evolavit, et mutationes passa est, ut caelo libere volitaret?” Risus inter discipulos ortus est, nam praesaepes (praesaepe -is, n.) in aedificiis rusticis inventae, nunc ad usum raris occasionibus tantum destinantur. Gaius autem, rei gravitatem intellegens, annotavit omnia. Post scholam, Gaius ad hortum botanicum ambulavit, ubi exempla evolutionis in plantarum variationibus conspicere poterat. Plantae, non secus atque animalia, diversificabantur et in formas novas emergebant. Gaius, in horto meditans, evolutionis exordia cogitavit. Quamvis ex praesaepibus et humilibus originibus omnia principia ducant, mirabilia naturae per saecula expansa sunt. Et sicut praeceptor sua doctrina, sic Gaius sua studia, ad novos horizontes eruditionis spe indefessa ducebat.	gpt-4-1106-preview
