Erant olim in Thessalia duo fratres, quorum alter Aeson, Pelias alter appellabatur. Aeson primo regnum obtinuerat; at post paucos annos Pelias regni cupiditate adductus non modo fratrem suum expulit, sed etiam in animo habebat Iasonem, Aesonis filium, interficere. Quidam tamen ex amicis Aesonis, ubi sententiam Peliae cognoverunt, puerum e tanto periculo eripere constituerunt. Noctu igitur Iasonem ex urbe abstulerunt, et cum postero die ad regem rediissent, ei renuntiaverunt puerum mortuum esse. Pelias cum hoc audivisset, etsi re vera magnum gaudium percipiebat, speciem tamen doloris praebuit et quae causa esset mortis quaesivit. Illi autem cum bene intellegerent dolorem eius falsum esse, nescio quam fabulam de morte pueri finxerunt.	gulo -ōnis, m. [wolverine],harēna lūbrica (v. gelida) -ae, f. [rink],īnstitūtm monetale -ī, n. [financial-instutution]	Temporibus modernis, in urbe tumultuosa, vixit adolescentes nomine Constantinus, qui pecuniariis rebus maxime interesse consueverat. Erat enim fervens studiorum īnstitūtī monetali adeptus, spe futurus magnum pecuniae peritum. Sed una cum pecuniis, aliquam peculiarem dilectionem habebat: scilicet, īnsolitis animalibus, quae raro in naturā videri poterant. Hac de causa, praeclarus erat gulo ēius, quem non a fera natura, sed ē domestica origine curabat, speciei rarae animalium amans. Nomen ēius erat Lucullus, et multī mirabantur quod tam mansuetus gulus poterat esse. Constantinus Lucullum ita docebat ut parvis pueris similem cuperet ostendere. Factum est autem ut Constantinus die quodam in harēnam lūbricam cum amicis iīret, ut artem patinatorum spectaret. Arēna illa, verno tempore operta et gelida, patinatores ē longinquō āllecebat; artis eius peritiam mirabantur omnes. Lucullus quoque, propter dominī affectum, secum fuit ductus, et patinantibus placide adspiciebat. Inter ludōs, per harēnam scatebris gliscere - spectaculum inusitatum - Lucullus animadvertit aliquid scintillāns inter gelidas asperitates. Constantinus, eius animi motibus peritus, de ēius mōtionibus suspicatus est aliquid inūsitātum, et propius adspiciendum accēssit. Erat illud numisma vetustum, quod in gelu harēnae diu latuerat. Investigatione facta, inlustris repperit nummum esse ālicuius antiquae valore magno. Delectatus tali fortuna, Constantinus, bonus et prudens īuvenis, statuit nummum prōferre et īnstitūtō monetālī, cui operam dabat, donare. Lucro alliciente, nōnnūllī cuperent nummum proprium facere, sed Constantinus plus de honestae vitae praemio quam de nummorum lucro cogitabat. Īnstitūtī vero monetālī praefecti, Constantini integritate cognita, adolescentem cum laudibus extulerunt, et scholam nomine ēius dedicavere, ubi studium oeconomicae peritia et rara animalium cura iunguntur. Sic Lucullus non solum deliciae domesticae, sed etiam virtutis exemplar Constantini factus est. Fama Constantini magistri et Luculli guli ēnsis per urbis plateas manavit, monetamque illam veterem in arēna lūbricā inventam, figūram pulchram et perpetuam virtutis et fortūnae īnstituit.	gpt-4-1106-preview
Hercules nihil mali suspicans vestem quam Lichas attulerat statim induit; paulo post tamen dolorem per omnia membra sensit, et quae causa esset eius rei magnopere mirabatur. Dolore paene exanimatus vestem detrahere conatus est; illa tamen in corpore haesit, neque ullo modo abscindi potuit. Tum demum Hercules quasi furore impulsus in montem Octam se contulit, et in rogum, quem summa celeritate exstruxit, se imposuit. Hoc cum fecisset, eos qui circumstabant oravit ut rogum quam celerrime succenderent. Omnes diu recusabant; tandem tamen pastor quidam ad misericordiam inductus ignem subdidit. Tum, dum omnia fumo obscurantur, Hercules densa nube velatus a Iove in Olympum abreptus est.THE ARGONAUTS The celebrated voyage of the Argonauts was brought about in this way. Pelias had expelled his brother Aeson from his kingdom in Thessaly, and had determined to take the life of Jason, the son of Aeson. Jason, however, escaped and grew up to manhood in another country. At last he returned to Thessaly; and Pelias, fearing that he might attempt to recover the kingdom, sent him to fetch the Golden Fleece from Colchis, supposing this to be an impossible feat. Jason with a band of heroes set sail in the ship Argo (called after Argus, its builder), and after many adventures reached Colchis. Here Aeetes, king of Colchis, who was unwilling to give up the Fleece, set Jason to perform what seemed an impossible task, namely to plough a field with certain fire-breathing oxen, and then to sow it with dragon's teeth. Medea, however, the daughter of the king, assisted Jason by her skill in magic, first to perform the task appointed, and then to procure the Fleece. She then fled with Jason, and to delay the pursuit of her father, sacrificed her brother Absyrtus. After reaching Thessaly, Medea caused the death of Pelias and was expelled from the country with her husband. They removed to Corinth, and here Medea becoming jealous of Glauce, daughter of Creon, caused her death by means of a poisoned robe. She was afterward carried off in a chariot sent by the sun-god, and a little later Jason was accidentally killed.	pedifollis -is, m. [soccer-ball],pecuārius -ī, m. [rancher],strōmata -ōrum, n. [miscellany]	In temporibus nostris, non lonānus ā Helvetiīs cum pedifollī eius magnī studiī erat. Is iuvenis in regione opulenta montium animalium curā pecuārius audax agebat. Attamen, quoad pedifollem pertinet, lonānus mentem suam strōmatīs varie illustratīs tamquam magistrō aptissimō tradendam censebat. Cotīdiē post labōrem in pratis verē amēnīs, ad ludum pedifollis festināvit. Amīcīsstrenue cum eō exercebantur, pedifollem nunc huc illuccē, nunc retrorsum scilicet propellentes. Erat autem in vicīniā eius quīdam pecuārius senex nōmine Laurentius, quī prope flūmen tranquillum bovēs pascebat. Laurentius, pedifollī prorsus ignārus, sēpenumero solitūdinem suam laudabat et ludum istum novā rum strobilōrum ineptiārum plēnum esse adfirmābat. Sed spectāculō unā nocte ā lonānō invitātus, vim magnam pedifollis cognovit. Cum pulchrē lūdērent, lonānus strēnuum ictum fecit, pedifollium valide percussit et eō in gaudium effūsit. Pedifollius summā celeritāte advolāvit et rete turbīne aquilinō similī intrāvit. "O mirum spectāculum!" exclāmāvit Laurentius, oculīs dilatātīs. "Vis haec pedifollis non modo corpora exercet, sed etiam animōs commovet et cōnnectit!" Eā nocte Laurentius ēmiscellāneīs vītae suae cogitātiōnibus ablātus est, et ardēns cupiditās ēius animum occupāvit – scilicet lūsus regulae cognoscendae. "Forsitan," in animō volutābat, "etiam giros istos pratorum meorum inter pecus meum transferre possim." Ex eā diē Laurentius pedifollī interesse coepit. Exercitātiōnem lūdicrām cum iuvenibus dīligentissimē didicisset, nēminī dubium fuit quīn etiam animī iuventūtis aeternā essent. Pecūs, velut spectātōrēs tacitī, ad hunc novī generis exercitium adhāerēbant, stōliātiōnēs īnsolitās herī contemplāntēs. Lonānus ac Laurentius amīcitiam firmam pēpigerunt, et strōmata vītae pecuāriae cum ludō pedifollī virtūtis exemplō miscuerunt. Ita per lūdum universaliter amatūm, quaedam hominum communitas novis vinculīs strīcta est, quae nōn modo per prata laurentiāna, sed etiam per totam provinciam sensim diffūnditur.	gpt-4-1106-preview
legio per tribunos militum ei gratias egit quod de se optimum iudicium fecisset, seque esse ad bellum gerendum paratissimam confirmavit. Deinde reliquae legiones cum tribunis militum et primorum ordinum centurionibus egerunt uti Caesari satis facerent: se neque umquam dubitasse neque timuisse neque de summa belli suum iudicium sed imperatoris esse existimavisse. Eorum satisfactione accepta et itinere exquisito per Diviciacum, quod ex Gallis ei maximam fidem habebat, ut milium amplius quinquaginta circuitu locis apertis exercitum duceret, de quarta vigilia, ut dixerat, profectus est. Septimo die, cum iter non intermitteret, ab exploratoribus certior factus est Ariovisti copias a nostris milia passuum IIII et XX abesse.	perca fluviātilis -ae, f. [bass],radiator -ōris, m. [radiator],ovārium -ī, n. [ovary]	In urbe moderna, quae plena est machinis et technologiae mirabilibus, habitat puella cui nomen est Julia. Huius puellae vita tranquilla et ordinata videbatur, sed aliquid ingens mox accidit quod omnia mutavit. Primum, in culina domus suae, Julia percam fluviatilem coquere constituit. Cum panem piscis in oleo frigeret, radiator subito defecit. Puella, frigore commota, coacta est aliquam solvendam viros ex arte peritorum rogare. Interim, perca in patina mansit, exspectans calorem qui numquam rediit. Die altero, quibusdam negotiis obstantibus clam in scholam pervenit, quod eam maxime vexabat. Dum in lectione Biologiae sedebat, discipulis de ovariis muliebribus eruditur. Julia, quamvis fessam, novum admirari coepit quoddam mysterium naturae, videlicet vitam quae intra ovare participatur. Vespera autem adveniente, Julia rerum gestarum diei cogitabat et quam in vita saepe necesse sit adaptari. Radiator frigidus et ovare reconditum illi ostenderunt quomodo inopinate res acciderent, cogentisque nos novas vias inventare. Et sic, ad finem historiae nostrae pervenimus, ubi memoramus et percam fluviatilen et radiatorem et ovarium non tantum rerum naturalium sed etiam vitae humanae esse partem, et turmas discipulorum edocentem semper esse paratissimam ad cognitionis fructus capiendos. Julia, etsi perrexisset sine radiatore calido et cum scientia biologica nova, intellexit sibi et aliis posse ad utilitates et difficultates aequo animo respondere. Ita magnis naturae mysteriis et quotidianis vitae problematibus, Julia sapientior facta est, memoria semper servans haec verba: "In vita, sicut in schola, praestat esse ad discendum quam ad formidandum paratam."	gpt-4-1106-preview
 Hac confirmata opinione timoris idoneum quendam hominem et callidum deligit, Gallum, ex iis quos auxilii causa secum habebat. Huic magnis praemiis pollicitationibusque persuadet uti ad hostes transeat, et quid fieri velit edocet. Qui ubi pro perfuga ad eos venit, timorem Romanorum proponit, quibus angustiis ipse Caesar a Venetis prematur docet, eque longius abesse quin proxima nocte Sabinus clam ex castris exercitum educat et ad Caesarem auxilii ferendi causa proficiscatur. Quod ubi auditum est, conclamant omnes occasionem negotii bene gerendi amittendam non esse: ad castra iri oportere. Multae res ad hoc consilium Gallos hortabantur:	asturco -ōnis, m. [palfrey],aquila -ae, f. [eagle],hydroplāni cymbula -ae, f. [pontoon]	In urbem magnam cui nomen "Metropolis" erat, aquila grandis et diligens in summo ædificii superbi nidum habebat. Volare per vastum cœlum solebat, super vias plenas hominum et vehiculorum spectaculum præbens eis qui paucae momenti speciem pulchri volatus capere volebant. Eius oculi acuti omnia videre poterant, a parvis piscibus in fluminibus urbis natantibus usque ad parvam cymbulam quæ longe in mari fluitabat. Hoc in die mirabili, aquila, nomine Aquilina, volabat altius quam antea, solitudinem lucentis cœli et libertatem volatus fruens, cum subito rem insolitam animadvertit. Puer nomine Gaius, studiosus et curiosus, studebat hydroplāni cymbulam circumducere. Hydroplāni cymbula erat novum vehiculum quod discere vellebat, et primum experimentum facere decidebat. Aquilina curiositate capta, descendit ut prope cernere posset. Gaius autem, cum aquilam vidisset, timuit ne aquila magno impetu cymbulam deleret. Tamen aquila, magnanimitate naturae suae acta, circulos in aere pingebat et Gaius fascinatus spectabat. Tandem Gaius, animo confirmato, hydroplāni cymbulam arte manu direxit. Aqua saliens et solem refringens, cymbula quasi avis aqua superabat. Eodem tempore, vir quidam dives, nomine Lucius, ex fenestra domus suae altissimae spectaculum observabat. Lucius equum habebat, asturcum nomine Astur, quem ad amoenas pratorum tractus ducere solebat. Astur non erat equus communis, sed præstans et docilis, vehiculum quoque urbanum atque elegans. Lucius, visione motus, statuit ut cum Gaius ad litus rediret, ipsi conjungerentur in perambulatione. Aquilina, operis sui finem videns, volavit ad nidum suum, tranquillitatis et quietis fruens, dum homines novas rerum experientias peragebant. In hac fabula tres comites diversa exercentes, astrurcum eques audax, aquila celsa volans, et hydroplāni cymbula super aquas natabat, ostendunt quomodo diversæ naturæ res conjungi possint ad humanas experientias locupletandas. Unusquisque modo suo contribuens, scilicet, asturco viam terrenam, aquila dominio aëreo et hydroplāno innovatione aquaticae navigationis, exemplar vita spectantium augent et docent.	gpt-4-1106-preview
 Prima luce productis omnibus copiis duplici acie instituta, auxiliis in mediam aciem coniectis, quid hostes consilii caperent expectabat.	resegmina unguium -um, n. [fingernail-clipping],ballistārius aērius -ī, m. [bombardier],prostata -ae, f. [prostate-gland]	Temporibus modernis, in urbe vasta et tumultuosa, vivit Aulus, ballistarius aerius peritus et industriosus. Vir egregius erat et militiam suam magno cum honore gerebat. Aulus, cui corpus robustum et animus intrepidus erant, in causis defensionis aëriæ laborabat. Die quadam, Aulus valitudinem suam curare decrevit. Medicus, vir doctus et prudentia clarus, repperit signa morbi prostatae. "Prostatae curatio," inquit medicus, "requirit animi tranquillitatem et corporis moderatam exercitationem." Aulo autem, qui semper in aeroplanis velocissimis ferebat, res quaedam minores et pacatae necessariae factae sunt. Ille, ob consilium medici, cohortem suam ballistariorum aerium relinquere coactus est ut valetudinem restitueret. Interea, in domo sua quiete, Aulus manuum curam magis attendit. Dum unguentum manibus adhibet, resegmina unguium adlucentia in pavimentum ceciderunt. Subito cogitavit de nitiditate parva et insignificanti, et de operibus magnis et fortibus quae antea fecerat. Resegmina unguium tam parva visu, tam similia rebus minus gravis momenti vitæ, momenti tamen suum habere potuerunt. Rationem vitae novam inveniens, Aulus didicit etiam minima momenta vitam magnopere afficere. Rebus parvis cura data, sicut cura unguium, salutem maiorem firmare potest. Sic vir fortis et industrius fato volente, ad vitae simplicioris et sanioris rationem pervenit.  Post tempus, prostatae morbus remeavit, et Aulus, cum sano corpore et mente tranquilla, ad munus suum ballistarius aerius redire potuit. Testimonium vitae periculorumque superatorum, ille nunc et magnos et parvos labores aequali animo excipit, ducebatque ex exemplo—salutem in juvandis et maioribus et rebus minoribus esse petendam.	gpt-4-1106-preview
Postquam Ligures hoc modo superati sunt, Hercules quam celerrime progressus est et post paucos dies ad Alpis pervenit. Necesse erat has transire, ut in Italiam boves ageret; res tamen summae erat difficultatis. Hi enim montes, qui ulteriorem a citeriore Gallia dividunt, nive perenni sunt tecti; quam ob causam neque frumentum neque pabulum in his regionibus inveniri potest. Hercules igitur antequam ascendere coepit, magnam copiam frumenti et pabuli comparavit et hoc commeatu boves oneravit. Postquam in his rebus tris dies consumpserat, quarto die profectus est, et contra omnium opinionem boves incolumis in Italiam traduxit.	vīnum aquatum (v. dilūtum) -ī, n. [wine-spritzer],(venēnum) pesticidale -is, n. [pesticide],clāva -ae, f. [golf-club]	Temporibus modernis, cum natura polluta et terra exhausta essent, Iulius agricola studiosus illuminationem quandam quaerere constituit. Sciebat enim venenum pesticidale non modo pestes sed etiam naturam ipsam affligere, et optabat methodum novam invenire qua segetes suae tutari possint. Iulius, vir perspicax et amoris antiquitatis, semper iam in horto laborans, vīnum aquatum ad laborem se reficere portabat. Erat enim haec potio non solum levis et grata, sed etiam memoria bonorum temporum antiquorum, quando purum et simple vīnum agricolis voluptatem dabat. Haec autem die, cum solis calore se oppressum sentiret, Iulius sub arbore sedebat et vīnum aquatum sibi indulgebat. Interea, animo volvente, coniecit si minus veneni pesticidalis in terra uteretur, forte melius fruges nascerentur. Subito autem discum metallicum, fulgentem in sole, conspexit. Erat clāva golfica quam adolescentes vicini perperam in hortum eius iecerant. Iulius, inspecta re, in meditatum sibi venit. Si terra curaretur et minore violenter tractaretur, nonne melior esset? Itaque, pro veneno pesticidali, coepit naturales modos adhibere. Herbas contra pestes plantavit, animalcula utilia allexit, et omnem curam in pristinam terrae virtutem reposuit. Clāvam golficam, quae semel missile irritum fuerat, in signum novi initii fecit, statuens in medio horti, ut recordaretur semper subtilitatis imperii naturalis supra violentiam. Temporibus illis longe diversis a Herculis aetate, Iulius bovem non duxit per Alpes, sed viam novam aperuit agriculturae sine temere veneni pesticidalis usum. Et mirum in modum segetes eius fieri coeperunt non solum uberiores, sed etiam salubriores. Gratia Iulii, et vicinia etiam - impressa eius exemplo - pesticidalia venena deserere et ad methodos amabiles naturae reverti coeperunt. Et sic, per hunc virum prudentem atque antiquitatis amatorem, nonnulla pars terrae nostri temporis iam melior atque salubrior facta est.	gpt-4-1106-preview
 Eodem tempore equites nostri levisque armaturae pedites, qui cum iis una fuerant, quos primo hostium impetu pulsos dixeram, cum se in castra reciperent, adversis hostibus occurrebant ac rursus aliam in partem fugam petebant; et calones, qui ab decumana porta ac summo iugo collis nostros victores flumen transire conspexerant, praedandi causa egressi, cum respexissent et hostes in nostris castris versari vidissent, praecipites fugae sese mandabant. Simul eorum qui cum impedimentis veniebant clamor fremitusque oriebatur, aliique aliam in partem perterriti ferebantur.	missile recellēns -is, n. [boomerang],gynaecēum (regium) -ī, n. [harem],homō abstinēns (tēmētō) -inis, m. [teetotaler]	In urbe magnā atque modernā, iuvenis nomine Iulius, cūius animus pacis amoribus deditus erat, in hortum publicum ivit ut novum instrūmentum, missile recellēns - quod hominēs ‘boomerang’ appellābant - experīrētur. Iulius, cum missile iaculātus esset, mirābātur quomodō semper ad eum redīret. Cuius lūdī perītiam spectantēs, multi circumstantēs gaudio āllectī sunt et clāmōrem tollēbant. Intereā, ventus validus cōepit, et hominēs aereālia ā sportātoribus in caelum missa mirantēs ab amphitheātrō procul exārdēscēbant velut in gynaecēō regiō, dulcis vitā fruentēs, et Iulius inter lūdos suī missilibus recellentibus ēnsis dedūcēbat. Subitō, ā partē alterā hortī appāruit vir gravis, homō abstinēns ā tēmētō, lectica magnificīs operibus picta elātus, specie odōrum suāvium perterritus, quī venit nuper ut hortum quietum sine vīnī voluptātibus quaereret. Quot cum abstinentia et temperantiā, princeps huius gynaecēī regiī erat, suīs hominium incōnsultum.  Cum acriter Iulium allocūtus esset dē perīculīs quae possent ē lūdīs missilibus orīrī, unum ex missilibus fortuitō in caput suum cecidit! Exclāmāvit ille, nōn īrātus sed rīsūs, et Iuliō dīxit, "Perītinax esse debēs ut legum nātūram et mōrēs hōminum discās; intrā gynaecēum regium ingredi non licet nīsī invītātus fueris." Iulius, prae laughter, missilē excusāvit et dē iīs prīncipīs doctrīnīs cōgitābat. Ab illā diē, Iulius et homō abstinēns amīcī factī sunt, et missilibus recellentibus saepe in hortō lūdebant, mīrābile dictū, ex nūllō potū corporēs sūōs corrumpentēs.	gpt-4-1106-preview
Cyclopes autem pastores erant quidam qui insulam Siciliam et praecipue montem Aetnam incolebant; ibi enim Volcanus, praeses fabrorum et ignis repertor, cuius servi Cyclopes erant, officinam suam habebat.Graeci igitur simul ac monstrum viderunt, terrore paene exanimati in interiorem partem speluncae refugerunt et se ibi abdere conabantur. Polyphemus autem (sic enim Cyclops appellabatur) pecus suum in speluncam compulit; deinde, cum saxo ingenti portam obstruxisset, ignem in media spelunca fecit. Hoc facto, oculo omnia perlustrabat, et cum sensisset homines in interiore parte speluncae esse abditos, magna voce exclamavit: "Qui homines estis? Mercatores an latrones?" Tum Ulixes respondit se neque mercatores esse neque praedandi causa venisse; sed a Troia redeuntis vi tempestatum a recto cursu depulsos esse. Oravit etiam ut sibi sine iniuria abire liceret. Tum Polyphemus quaesivit ubi esset navis qua vecti essent; sed Ulixes cum sibi maxime praecavendum esse bene intellegeret, respondit navem suam in rupis coniectam omnino fractam esse. Polyphemus autem nullo responso dato duo e sociis manu corripuit, et membris eorum divulsis carnem devorare coepit.	pīleus strāmineus -ī, m. [hatstrawhat],crocodīlus ī, m. [crocodile],dēlīnātio sectiōnis perpendiculāris -ōnis, f. [elevation-architectural-drawing]	In hodierno tempore, narratio de viro, nomine Iulio, incipit, qui industriam architecturae studebat. Pulcher et studiosus, Iulius multum de geometria et aedificiorum arte sciebat. Die quodam, Iulius dēlīnātiōnem sectiōnis perpendiculāris magni aedificii conficere debebat. Officium erat arduum, sed Iulius ingenio egregio praeditus erat. Dum in tabula delineavit, Iulius ad fenestram respexit et mirum in modum vidit pīleum strāmineum portentosum, qui in vento volitabat. Risit Iulius et cogitavit de simplicitate vitae ruralis. Rapuit autem pīleum per fenestram et super caput suum posuit. Calor diei erat vehemens, et umbraculum pīlei gratissimum sensum praebuit. Subito, Iulius telephono vocatus est ab amico suo, Aulo, qui in horto zoologico laborabat. Aulus in magna erat trepidatione, dicens: "O Iuli, auxilium tuum opus est. Crocodīlus noster fugit!" Iulius, postquam verba audivit, statim surrexit. "Noli timere," inquit Iulius, "iam advenio!" Cum ingenium et audacia Iulii, confidebat Aulus re bene gerenda. Cum Iulius ad hortum zoologicum pervenit, signum dat Aulo. Tum in modum fabulae veteris, accedunt ad locum ubi crocodīlus deprehensus erat. Animal magni corporis in aqua repertum est, prope fontem publicum. Veluti Ulixes olim, Iulius callide crocodīlum ad sedem suam revocare debuit. Tum Iulius pīleum strāmineum sibi a capite detrahit et in aquam prope crocodīlum iacit. Monstrum, novi quiddam videns, ad pīleum accedebat. Iulio ad arma ingenii utente, leniter crocodīlum mollibat, et ducere poterat. Aulo clamante "O amice praeclare! Iulius, peritissime!” crocodīlus ad sēdem suam in horto redibat. Tanta erat laetitia ut omnes Iulium laudarent, eum heroem modernum appellant. Hac in historia exemplum Iulii stat, ut adulescentes docerentur non solum de artibus liberalibus sed etiam de prudentia et alacritate in rebus subitis. Ars et scientia cum virtute animi sunt qualitates quae utiles manserunt per saecula, tam in fabulis antiquis quam in vita cotidiana nostra.	gpt-4-1106-preview
